root@Ubuntu-Droplet-DiegoHidenori:~# tcpdump -n -i eth0
tcpdump: verbose output suppressed, use -v[v]... for full protocol decode
listening on eth0, link-type EN10MB (Ethernet), snapshot length 262144 bytes
02:39:00.551123 IP 143.198.37.250.22 > 173.32.87.169.32579: Flags [P.], seq 3007279805:3007279913, ack 2763009017, win 501, length 108
02:39:00.551177 IP 143.198.37.250.22 > 173.32.87.169.32579: Flags [P.], seq 108:144, ack 1, win 501, length 36
02:39:00.551216 IP 143.198.37.250.22 > 173.32.87.169.32579: Flags [P.], seq 144:196, ack 1, win 501, length 52
02:39:00.551597 IP 143.198.37.250.22 > 173.32.87.169.32579: Flags [P.], seq 196:264, ack 1, win 501, length 68
02:39:00.551682 IP 143.198.37.250.22 > 173.32.87.169.32579: Flags [P.], seq 264:368, ack 1, win 501, length 104
02:39:00.562339 IP 173.32.87.169.32579 > 143.198.37.250.22: Flags [.], ack 108, win 2046, length 0
02:39:00.562339 IP 173.32.87.169.32579 > 143.198.37.250.22: Flags [.], ack 196, win 2046, length 0
02:39:00.562339 IP 173.32.87.169.32579 > 143.198.37.250.22: Flags [.], ack 368, win 2045, length 0
02:39:00.651921 IP 143.198.37.250.22 > 173.32.87.169.32579: Flags [P.], seq 368:1292, ack 1, win 501, length 924
02:39:00.728372 IP 173.32.87.169.32579 > 143.198.37.250.22: Flags [.], ack 1292, win 2047, length 0
02:39:00.755816 IP 143.198.37.250.22 > 173.32.87.169.32579: Flags [P.], seq 1292:1544, ack 1, win 501, length 252
02:39:00.817137 IP 173.32.87.169.32579 > 143.198.37.250.22: Flags [.], ack 1544, win 2046, length 0
02:39:00.859825 IP 143.198.37.250.22 > 173.32.87.169.32579: Flags [P.], seq 1544:1796, ack 1, win 501, length 252
02:39:00.911629 IP 173.32.87.169.32579 > 143.198.37.250.22: Flags [.], ack 1796, win 2046, length 0
02:39:00.963865 IP 143.198.37.250.22 > 173.32.87.169.32579: Flags [P.], seq 1796:2048, ack 1, win 501, length 252
02:39:01.019621 IP 173.32.87.169.32579 > 143.198.37.250.22: Flags [.], ack 2048, win 2045, length 0
02:39:01.067817 IP 143.198.37.250.22 > 173.32.87.169.32579: Flags [P.], seq 2048:2300, ack 1, win 501, length 252
02:39:01.129086 IP 173.32.87.169.32579 > 143.198.37.250.22: Flags [.], ack 2300, win 2044, length 0
02:39:01.171835 IP 143.198.37.250.22 > 173.32.87.169.32579: Flags [P.], seq 2300:2552, ack 1, win 501, length 252
02:39:01.236681 IP 173.32.87.169.32579 > 143.198.37.250.22: Flags [.], ack 2552, win 2043, length 0
02:39:01.275874 IP 143.198.37.250.22 > 173.32.87.169.32579: Flags [P.], seq 2552:2804, ack 1, win 501, length 252
02:39:01.329108 IP 173.32.87.169.32579 > 143.198.37.250.22: Flags [.], ack 2804, win 2047, length 0
02:39:01.379796 IP 143.198.37.250.22 > 173.32.87.169.32579: Flags [P.], seq 2804:3056, ack 1, win 501, length 252
02:39:01.436632 IP 173.32.87.169.32579 > 143.198.37.250.22: Flags [.], ack 3056, win 2046, length 0
02:39:01.483865 IP 143.198.37.250.22 > 173.32.87.169.32579: Flags [P.], seq 3056:3308, ack 1, win 501, length 252
02:39:01.544657 IP 173.32.87.169.32579 > 143.198.37.250.22: Flags [.], ack 3308, win 2046, length 0
02:39:01.587885 IP 143.198.37.250.22 > 173.32.87.169.32579: Flags [P.], seq 3308:3560, ack 1, win 501, length 252
02:39:01.652480 IP 173.32.87.169.32579 > 143.198.37.250.22: Flags [.], ack 3560, win 2045, length 0
02:39:01.691857 IP 143.198.37.250.22 > 173.32.87.169.32579: Flags [P.], seq 3560:3812, ack 1, win 501, length 252
02:39:01.749621 IP 173.32.87.169.32579 > 143.198.37.250.22: Flags [.], ack 3812, win 2044, length 0
02:39:01.795855 IP 143.198.37.250.22 > 173.32.87.169.32579: Flags [P.], seq 3812:4064, ack 1, win 501, length 252
02:39:01.853447 IP 173.32.87.169.32579 > 143.198.37.250.22: Flags [.], ack 4064, win 2043, length 0
02:39:01.899866 IP 143.198.37.250.22 > 173.32.87.169.32579: Flags [P.], seq 4064:4316, ack 1, win 501, length 252
02:39:01.962641 IP 173.32.87.169.32579 > 143.198.37.250.22: Flags [.], ack 4316, win 2047, length 0
^C
34 packets captured
38 packets received by filter
0 packets dropped by kernel
root@Ubuntu-Droplet-DiegoHidenori:~#
